<?xml version='1.0' encoding='UTF-8' ?>

<sicherheitsDienst xmlns:xsi="http://www.w3.org/2001/XMLSchema-instance" xsi:noNamespaceSchemaLocation="../xsd/db.xsd"
	title="Sicherheitsdienst">

	<sicherheitsUnternehmen name="Firma" email="xyz@mail.de" telefon="0171/4454567">
		
			<adresse hausnummer="10a" strasse="Oberstrasse" stadt="Bremen" zip="12313" />
		
		    <alleMitarbeiter>
		    	<mitarbeiter id="1" name="Mueller" vorname="Hans">
			        <dienstalter_monate>10</dienstalter_monate>
			        <fuehrerschein>ja</fuehrerschein>
		        </mitarbeiter>
		    </alleMitarbeiter>
		    
		    <gebiete>
			    <gebiet id="1">
			    	<gebietSchutzObjekte>
			        	<objekt_id>1</objekt_id>
			        </gebietSchutzObjekte>
			        <mitarbeiter_id>1</mitarbeiter_id>
			    </gebiet>
		    </gebiete>
		    
		    <kunden>
			    <kunde id="1" name="Mustermann" vorname="Johannes">
			    	<geburtsDatum>1990-07-01</geburtsDatum>
			    	<unternehmen>Lubke Werkstatt</unternehmen>
			        <telefon>04792/5566</telefon>
			        <email>xxx@mail.de</email>
			        <schutzObjekte>
				        <objekt id="1">
					        <objektAdresse hausnummer="1" strasse="Leipziger Str." stadt="Bremen" zip="12320">
						        <koordinate_x>51.0412414</koordinate_x>
						        <koordinate_y>51.0412414</koordinate_y>
						    </objektAdresse>
					    </objekt>
				    </schutzObjekte>
			    </kunde>
		    </kunden>
		
			<unfaelle>
			    <unfall id="1">
			    	<kunde_id>1</kunde_id>
			        <objekt_id>1</objekt_id>
			        <datum>2015-09-21</datum>
			        <uhrzeit>22:12</uhrzeit>
			        <ursache>Signalisierung</ursache> 
			    </unfall>
		    </unfaelle>
		    
		    <rechnungen>
			    <rechnung id="33" unfallId="1">
			    	<rechnungsBetrag>12.00 EUR</rechnungsBetrag>
					<status>bezahlt</status>
			    </rechnung>
		    </rechnungen>
	</sicherheitsUnternehmen>
</sicherheitsDienst>
